{
    "schema_version":  1,
    "generated":  "2026-09-25T12:54:18Z",
    "sprint_goal":  "Implement task completion endpoint",
    "task_count":  18,
    "active_count":  10,
    "blocked_count":  0,
    "done_count":  2,
    "active_task_ids":  [
                            "AICO-003",
                            "AICO-004",
                            "AICO-005",
                            "AICO-006",
                            "AICO-007",
                            "AICO-009",
                            "AICO-010",
                            "AICO-011",
                            "AICO-012",
                            "AICO-013"
                        ],
    "blocked_task_ids":  [

                         ]
}